{
  "$schema": "https://json-schema.org/draft/2020-12/schema",
  "$id": "https://design-lab.local/schemas/verify-report.schema.json",
  "title": "design-lab whole-file verification receipt",
  "type": "object",
  "required": [
    "standardVersion",
    "generatedAt",
    "open",
    "waived",
    "passed",
    "inapplicable",
    "completeness"
  ],
  "properties": {
    "standardVersion": {
      "type": "string"
    },
    "generatedAt": {
      "type": "string"
    },
    "open": {
      "type": "array",
      "items": {
        "type": "object",
        "properties": {
          "check": {
            "type": "string"
          },
          "detail": {
            "type": "string"
          },
          "evidence": {
            "type": [
              "array",
              "null"
            ],
            "items": {
              "type": [
                "string",
                "number"
              ]
            }
          },
          "scope": {
            "type": "string"
          },
          "severity": {
            "type": "string"
          }
        }
      }
    },
    "waived": {
      "type": "array",
      "items": {
        "type": "object",
        "properties": {
          "check": {
            "type": "string"
          },
          "detail": {
            "type": "string"
          },
          "evidence": {
            "type": [
              "array",
              "null"
            ],
            "items": {
              "type": [
                "string",
                "number"
              ]
            }
          },
          "scope": {
            "type": "string"
          },
          "severity": {
            "type": "string"
          },
          "waiver": {
            "type": "object",
            "properties": {
              "check": {
                "type": "string"
              },
              "date": {
                "type": "string"
              },
              "decidedBy": {
                "type": "string"
              },
              "reason": {
                "type": "string"
              },
              "scope": {
                "type": "string"
              }
            }
          }
        }
      }
    },
    "passed": {
      "type": "array",
      "items": {
        "type": "string"
      }
    },
    "inapplicable": {
      "type": "array",
      "items": {
        "type": "string"
      }
    },
    "completeness": {
      "type": "object",
      "properties": {}
    }
  },
  "additionalProperties": true
}
